patient_id	patient_accession	external_study	details	doc_id	doc_filename
ALL	ALL		NGLY1 deficiency (OMIM: 610661 and 615273), or NGLY1-CDDG, was first reported in 2012 by Need et al., who, through exome sequencing, identified biallelic mutations in the NGLY1 gene as the cause of disease in one child.	PMC7477955	PMC7477955.txt
index case	index case		3-year-old male with NGLY1 deficiency. Inherited a maternal c.1891delC (p.Q631S NM_018297.3) variant and a paternal c.1201A>T (p.R401* NM_018297.3) variant. NGLY1 protein expression in leukocytes was undetectable compared to controls. Transferrin isoelectric focusing and N-glycan profiling were normal.	PMC7477955	PMC7477955.txt
parents of index case	parents of index case		Parents of the index case had reduced NGLY1 protein expression in leukocytes compared to controls.	PMC7477955	PMC7477955.txt
ALL	ALL	Enns et al.	In 2014, a retrospective chart review highlighted the most common findings in eight known NGLY1-CDDG patients.	PMC7477955	PMC7477955.txt
ALL	ALL	NIH Clinical Center	A natural history study of the disorder was initiated at the National Institutes of Health (NIH) Clinical Center (trial NCT00369421 and trial NCT02089789). This report documents the results of comprehensive, prospective, clinical, molecular, radiologic, and laboratory investigations performed on 12 affected individuals.	PMC7477955	PMC7477955.txt
ALL	ALL		Clinical studies were designed to detail the phenotypic features of NGLY1-CDDG. Blood, urine, cerebral spinal fluid (CSF), lymphoblasts, and primary dermal fibroblasts were collected, analyzed, and stored. Studies included brain magnetic resonance imaging and spectroscopy (MRI and MRS), routine and overnight electroencephalograms (EEGs) with a limited montage performed during a sleep study, electromyogram (EMG) and nerve conduction studies (NCS), indirect calorimetry, awake and sedated eye examination with Schirmer II testing, optical coherence tomography scans and electroretinography, behavioral determination of pure tone thresholds, tympanometry, distortion product otoacoustic emissions, auditory brainstem evoked potentials (ABR), quantitative sweat analysis autonomic testing (QSWEAT), gastric aspiration, swallow study, skeletal survey, bone age, dual X-ray absorptiometry (DEXA), abdominal ultrasound, vibration controlled transient elastography (Fibroscan), echocardiogram, and electrocardiogram. Consultations included clinical neurology, audiology, nutrition, ophthalmology, hepatology, growth, puberty and hormonal studies, allergy and immunology, genetic counseling, physiatry, and speech, occupational, and physical therapy. Eleven individuals underwent developmental psychological evaluations, consisting of at least the Vineland Adaptive Behavior Scales, 2nd edition. Cognitive function was assessed with testing specific for age and developmental level that provided either an intelligence quotient (IQ) or developmental quotient (DQ) score. In addition, the Nijmegen pediatric CDG rating scale, a measure of clinical disease progression developed for CDG, was applied to all affected individuals younger than 18 years.	PMC7477955	PMC7477955.txt
ALL	ALL		Twelve individuals from ten families with confirmed biallelic mutations in NGLY1 were admitted to the NIH Clinical Center. All individuals (six female; six male) were white and ranged from 2.5– 21.3 years of age. We identified 13 different mutations: five missense, five nonsense, two splice site, and one frameshift mutation. The most common mutation was c.1201A>T (p.R401*), occurring in seven alleles. The mutations were widely dispersed along the gene with no obvious hotspot. Only four of the mutations lay within the catalytic domain.	PMC7477955	PMC7477955.txt
#2	#2		Included in previous clinical publications.	PMC7477955	PMC7477955.txt
#3	#3		Included in previous clinical publications. Has a sibling also with NGLY1 deficiency (#11).	PMC7477955	PMC7477955.txt
#6	#6		Included in previous clinical publications.	PMC7477955	PMC7477955.txt
#9	#9		Included in previous clinical publications.	PMC7477955	PMC7477955.txt
#11	#11		Included in previous clinical publications. Has a sibling also with NGLY1 deficiency (#3).	PMC7477955	PMC7477955.txt
#12	#12		Included in previous clinical publications.	PMC7477955	PMC7477955.txt
#7	#7		Has a sibling also with NGLY1 deficiency (#8).	PMC7477955	PMC7477955.txt
#8	#8		Has a sibling also with NGLY1 deficiency (#7).	PMC7477955	PMC7477955.txt
1	1		3 year old male with NGLY1 deficiency. Allele 1 mutation: c.953T>C (p.L318P). Allele 2 mutation: c.1169G>C (p.R390P). Nijmegen score: 14. Vineland score: 62. IQ or DQ not determined.	PMC7477955	PMC7477955.txt
2	2		4 year old male with NGLY1 deficiency. Allele 1 mutation: c.1201A>T (p.R401*). Allele 2 mutation: c.1201A>T (p.R401*). Nijmegen score: 33. IQ or DQ: 25. Vineland score: 52.	PMC7477955	PMC7477955.txt
3	3		4 year old female with NGLY1 deficiency. Allele 1 mutation: c.1201A>T (p.R401*). Allele 2 mutation: c.1201A>T (p.R401*). Nijmegen score: 34. IQ or DQ: 5. Vineland score: 40.	PMC7477955	PMC7477955.txt
4	4		5 year old female with NGLY1 deficiency. Allele 1 mutation: c.931G>A (p.E311K). Allele 2 mutation: c.730T>C (p.W244R). Nijmegen score: 33. IQ or DQ not determined. Vineland score not determined.	PMC7477955	PMC7477955.txt
5	5		6 year old male with NGLY1 deficiency. Allele 1 mutation: c.1604G>A (p.W535*). Allele 2 mutation: c.1910delT (p.L637*). Nijmegen score: 25. IQ or DQ: 8. Vineland score: 43.	PMC7477955	PMC7477955.txt
6	6		7 year old male with NGLY1 deficiency. Allele 1 mutation: c.1891delC (p.Q631S). Allele 2 mutation: c.1201A>T (p.R401*). Nijmegen score: 36. IQ or DQ: 5. Vineland score: 37.	PMC7477955	PMC7477955.txt
7	7		8 year old female with NGLY1 deficiency. Allele 1 mutation: c.622C>T (p.Q208*). Allele 2 mutation: c.930C>T (p.G310G - splice site). Nijmegen score: 10. IQ or DQ: 74. Vineland score: 98.	PMC7477955	PMC7477955.txt
8	8		10 year old male with NGLY1 deficiency. Allele 1 mutation: c.622C>T (p.Q208*). Allele 2 mutation: c.930C>T (p.G310G - splice site). Nijmegen score: 9. IQ or DQ: 81. Vineland score: 94.	PMC7477955	PMC7477955.txt
9	9		16 year old male with NGLY1 deficiency. Allele 1 mutation: c.347C>G (p.S116*). Allele 2 mutation: c.881+5G>T (IVS5+5G>T). Nijmegen score: 32. IQ or DQ: 2. Vineland score: 28.	PMC7477955	PMC7477955.txt
10	10		17 year old female with NGLY1 deficiency. Allele 1 mutation: c.1201A>T (p.R401*). Allele 2 mutation: c.1201A>T (p.R401*). Nijmegen score: 25. IQ or DQ: 16. Vineland score: 42.	PMC7477955	PMC7477955.txt
11	11		18 year old female with NGLY1 deficiency. Allele 1 mutation: c.1201A>T (p.R401*). Allele 2 mutation: c.1201A>T (p.R401*). Nijmegen score: 52. IQ or DQ: 2. Vineland score: 24.	PMC7477955	PMC7477955.txt
12	12		21 year old female with NGLY1 deficiency. Allele 1 mutation: c.1370dupG (p.R458Kfs*14). Allele 2 mutation: c.1370dupG (p.R458Kfs*14). Nijmegen score not determined. IQ or DQ not determined. Vineland score: 37.	PMC7477955	PMC7477955.txt
ALL	ALL		Most affected individuals had hypotonic facies, and the features of older individuals reflected their low weight, with thin facies, hollowed cheeks, and visible zygomatic arches. Eye measurements, performed on 10 subjects, varied broadly and revealed no consistent abnormality.	PMC7477955	PMC7477955.txt
ALL	ALL		Ten of twelve subjects were born at term; two were born at 36 and 34 weeks, respectively. In the majority of individuals, birth weight, length, and occipital-frontal circumference (OFC) were appropriate for gestational age.	PMC7477955	PMC7477955.txt
ALL	ALL		Individuals grew poorly after mid-childhood, with weight affected more than height. Acquired microcephaly was documented in the four oldest subjects.	PMC7477955	PMC7477955.txt
ALL	ALL		The total foot length was < 3rd percentile in all 12 individuals.	PMC7477955	PMC7477955.txt
ALL	ALL		11 individuals under age 18 years were evaluated using the Nijmegen Pediatric CDG Severity scale. Total Nijmegen scores ranged from 9 (mild) to 52 (severe), with a mean of 28 ± 4 (SEM); the median was 32.	PMC7477955	PMC7477955.txt
SOME	SOME		Three individuals scored in the mild range, two in the moderate range, and six in the severe range.	PMC7477955	PMC7477955.txt
SOME	SOME		All five individuals carrying the common mutation c.1201A>T were either moderately or severely impaired; those carrying at least one copy had a higher mean score (36) than those without this mutation (20.5).	PMC7477955	PMC7477955.txt
7	7		The sibling with a private cryptic splice site mutation (c.930C>T) and a private nonsense mutation (c.622C>T) exhibited relatively mild impairment in all domains.	PMC7477955	PMC7477955.txt
8	8		The sibling with a private cryptic splice site mutation (c.930C>T) and a private nonsense mutation (c.622C>T) exhibited relatively mild impairment in all domains.	PMC7477955	PMC7477955.txt
ALL	ALL		There was no significant difference in disease severity of males compared to females.	PMC7477955	PMC7477955.txt
ALL	ALL		All twelve subjects had at least some developmental delay or intellectual disability, with a broad range of severity. IQ was below average (n=2) or in the range of intellectual disability (n=9) for the entire group; seven individuals had profound intellectual disability. The two individuals with IQ below average were verbally fluent; the remainder were nonverbal (n=7) or used only single words (n=1) or phrase speech (n=1).	PMC7477955	PMC7477955.txt
ALL	ALL		On the Vineland Adaptive Behavior Scales, Second Edition, composite scores ranged from 24 to 98 with a mean of 51 (SEM = 7). There was a consistent profile characterized by relatively strong Socialization scores, followed by Communication, and Daily Living Skills. Motor deficits were also reflected in impaired Daily Living Skills scores. Vineland scores were higher than cognitive scores for all subjects. No cross-sectional relationship between age and Vineland Adaptive Behavior Composite was found.	PMC7477955	PMC7477955.txt
ALL	ALL		All twelve individuals exhibited hyperkinetic movement disorders that included choreiform, athetoid, dystonic, myoclonic, action tremor, and dysmetric movements and were more severe in the younger individuals.	PMC7477955	PMC7477955.txt
SOME	SOME		Seven of twelve subjects had clinical seizures, and one had subclinical seizures recognized on previous EEG. There were no age or genotype differences between individuals having seizures and those without. In each sibling pair, one had seizures and the other did not.	PMC7477955	PMC7477955.txt
#6	6		On overnight EEG, only one individual (#6) had active seizures recorded.	PMC7477955	PMC7477955.txt
ALL	ALL		Eleven individuals underwent MRI and MRS of the brain. Clinical assessment of the images was not striking. Delayed myelination was present in three of the four youngest individuals, but all the older individuals had complete myelination.	PMC7477955	PMC7477955.txt
SOME	SOME		Six of nine individuals had qualitatively-evident cerebral atrophy that ranged from slight to moderate.	PMC7477955	PMC7477955.txt
#1	#1		Had slight cerebellar atrophy.	PMC7477955	PMC7477955.txt
#2	#2		Had slight cerebellar atrophy.	PMC7477955	PMC7477955.txt
#6	#6		Had slight cerebellar atrophy.	PMC7477955	PMC7477955.txt
#10	#10		Had slight cerebellar atrophy.	PMC7477955	PMC7477955.txt
SOME	SOME		The atrophy tended to be greater in the older individuals.	PMC7477955	PMC7477955.txt
#11	#11		One teenager had follow-up imaging showed atrophy measurably worse after a 20-month interval (net loss of 34 cm3 relative to expected).	PMC7477955	PMC7477955.txt
ALL	ALL		Increased atrophy correlated with worsening of all functional measurements, including IQ or DQ, Vineland assessments, and Nijmegen scores. Brain volume also directly correlated with CSF levels of 5-HIAA, tetrahydrobiopterin, and 5-HVA.	PMC7477955	PMC7477955.txt
ALL	ALL		N-acetylaspartylglutamate + N-acetylaspartate (NAA) was lower than normal in the left centrum semiovale (LCSO), the midline parietal grey matter (PGM), and superior cerebellar vermis (SVERM). There was a deficit of glutamine + glutamate + gamma-aminobutyric acid (Glx) in the PGM, LCSO, and pons. Choline was higher than expected for age only in the LCSO, and myo-inositol was higher than expected for age in the pons. Multiple correlations between these MRS-measured metabolites and age, functional assessments, brain volume, and neurotransmitters in the CSF were found. The general trend showed that the differences noted above became more pronounced with increasing age, worsening function, and lower brain volume. MRS metabolite measurements did not correlate with total CSF protein, CSF albumin, or CSF/serum albumin ratio. There was a weak correlation between atrophy and total CSF protein, but not CSF albumin or CSF/serum albumin ratio.	PMC7477955	PMC7477955.txt
ALL	ALL		Nine subjects underwent lumbar puncture. CSF total protein and albumin concentrations, as well as the CSF/serum albumin ratios, were low in nearly all individuals. There was no correlation between age and CSF protein or albumin levels. CSF 5-HIAA, HVA, and BH4 levels strongly and directly correlated with brain atrophy. CSF lactate and amino acid levels were essentially normal. CSF leucocyte counts (0–4; normal 0–5), glucose concentrations (54–72 mg/dL; normal 40–70), 3-O-methyldopa concentrations (12–28 nM; normal <150) and 5-methyltetrahydrofolate concentrations (45– 85 nmol/L; normal 40–150) were unremarkable.	PMC7477955	PMC7477955.txt
SOME	SOME		In the two oldest subjects, CSF 5-hydroxyindolacetic acid (5-HIAA) and homovanillic acid (HVA) were decreased, suggesting neuronal loss.	PMC7477955	PMC7477955.txt
ALL	ALL		Neopterin levels were normal but decreased with age, and CSF tetrahydrobiopterin (BH4) levels were below the lower limit of normal in all but one subject tested; however, there was no correlation with age.	PMC7477955	PMC7477955.txt
ALL	ALL		Nerve conduction studies were performed in 11 individuals. The predominant finding was an axonal sensorimotor polyneuropathy (n=8) with additional demyelinative features (n=6). Results of neurophysiological testing demonstrated a length- dependent, progressive loss of sensory and motor axons and sympathetic nerve function, apparently static abnormalities in myelination of peripheral nerves, and possible motor neuron degeneration.	PMC7477955	PMC7477955.txt
#6	6		A single individual had a repeat study at one year, showing progression of the neuropathy.	PMC7477955	PMC7477955.txt
SOME	SOME		On needle EMG, neurogenic findings were noted in 9 subjects with varying degrees of acute and chronic changes consistent with the NCS results.	PMC7477955	PMC7477955.txt
ALL	ALL		QSWEATs were performed in 11 individuals, abnormal results were found in 8 individuals who also had axonal sensorimotor neuropathies. The distal lower extremity QSWEAT was more frequently absent (7/11) compared to the forearm (1/11), indicating a length dependent neuropathy. There was a trend to greater severity of neuropathy in the older individuals, with an inverse correlation between tibial motor amplitude and age (p = 0.002, r2 = 0.799); the amplitude decreased by −0.3 mV per year (normal, >+2.5mV per year).	PMC7477955	PMC7477955.txt
ALL	ALL		Awake and sedated ophthalmic examinations were performed on 11 study participants. Observed conditions include Lagophthalmous, ptosis, exotropia and/or esotropia, corneal neovascularization, pannus formation or scarring, optic nerve pallor or atrophy, retinal.	PMC7477955	PMC7477955.txt
ALL	ALL		All individuals had evidence of hypo- or complete alacrima on Schirmer II testing. Tear production did not correlate with age. Pigmentary changes including pigment granularity and pigmentary retinopathy or pigmentary changes, blonde or poorly pigmented retinal periphery, and refractive errors were observed.	PMC7477955	PMC7477955.txt
SOME	SOME		One participant underwent sedated electroretinography and was diagnosed with cone dystrophy; the photopic responses were reduced to ~50% of the lower limit of normal for age.	PMC7477955	PMC7477955.txt
ALL	ALL		Audiologic assessments, including otoacoustic emissions and/or cochlear microphonics to evaluate for the functional integrity of the inner ear, and auditory brainstem response (ABRs), were conducted on 11 subjects. Behavioral hearing thresholds could be established reliably in only three subjects and all had normal hearing sensitivity. Tympanometry was unremarkable. Most remarkable was the dyssynchronous and/or absent transmission through the auditory brainstem and/or 8th nerve in most individuals. The severity of the transmission abnormality through the auditory brainstem increased with increasing age, and the eighth nerve was bilaterally involved the 4 oldest individuals.	PMC7477955	PMC7477955.txt
ALL	ALL		Clinical feeding and modified barium swallow assessments were performed on 11 subjects. Oral motor deficits, including persistent nutritive suckle swallow and poor oral bolus formation, were present in 10 of 11. Premature spillage and pharyngeal swallow response delays remained the primary deficits of all subjects. No aspiration or laryngeal penetration for any textures were observed in the swallow studies. Developmental delays in mastication were evident and characterized by munching patterns without matured rotary chewing of solid textures. Generalized weakness of the lips and tongue was observed in all individuals during cranial nerve assessments. Dystonic movements of the tongue and persistent oral reflexes of suckling and suck/swallows were seen in the majority of individuals.	PMC7477955	PMC7477955.txt
ALL	ALL		Echocardiograms were unremarkable	PMC7477955	PMC7477955.txt
ALL	ALL		Electrocardiograms showed heart rates in the low 100s	PMC7477955	PMC7477955.txt
SOME	SOME		Two individuals had QTcB >440 ms, but a normal QTcF	PMC7477955	PMC7477955.txt
SOME	SOME		Sleep studies identified evidence of obstructive sleep apnea in two individuals	PMC7477955	PMC7477955.txt
SOME	SOME		One individual had central sleep apnea	PMC7477955	PMC7477955.txt
SOME	SOME		Two individuals had combined obstructive and central sleep apnea	PMC7477955	PMC7477955.txt
SOME	SOME		Five individuals had frequent periodic limb movements	PMC7477955	PMC7477955.txt
ALL	ALL		No associations between age and either sleep apnea or frequent periodic limb movements	PMC7477955	PMC7477955.txt
ALL	ALL		Gastric pH was assessed after H2 blockers and osmotic pump inhibitors had been discontinued for 5 days. Gastric pH was appropriately acidic in all individuals tested except one, whose pH was 7.25.	PMC7477955	PMC7477955.txt
SOME	SOME		Ten of twelve individuals had some degree of constipation.	PMC7477955	PMC7477955.txt
SOME	SOME		Abdominal ultrasounds were normal in six of 12 individuals. Abnormalities in abdominal ultrasound included splenomegaly, steatosis, coarse or inhomogeneous liver texture, or hepatomegaly.	PMC7477955	PMC7477955.txt
ALL	ALL		No hydronephrosis, polycystic kidneys, horseshoe kidneys, kidney calculi, nephrocalcinosis, or perinephric fluid were seen.	PMC7477955	PMC7477955.txt
SOME	SOME		Three of twelve had Fibroscan scores above 7 kPa, the upper limit of normal, indicating possible liver fibrosis.	PMC7477955	PMC7477955.txt
SOME	SOME		Resting energy expenditure was close to 100% of expected in three individuals, but ranged from 51% to 82% of predicted in the other 9.	PMC7477955	PMC7477955.txt
ALL	ALL		Laboratory values reflecting gastrointestinal and hepatic function were essentially normal at the time of the NIH evaluation.	PMC7477955	PMC7477955.txt
SOME	SOME		Chart review revealed elevations in aspartate aminotransferase (AST) and/or alanine transaminase (ALT) in all eight subjects that had these measured in their first two years of life.	PMC7477955	PMC7477955.txt
ALL	ALL		One individual had undergone liver transplantation for presumed hepatocellular carcinoma.	PMC7477955	PMC7477955.txt
ALL	ALL		These transaminase levels normalized around age 4.	PMC7477955	PMC7477955.txt
ALL	ALL		Circulating proteins were normal or borderline low in all individuals.	PMC7477955	PMC7477955.txt
ALL	ALL		Total cholesterol, LDL, and triglycerides were also low.	PMC7477955	PMC7477955.txt
SOME	SOME		In the two subjects with the lowest cholesterol levels, high density lipoprotein, low density lipoprotein, and very low density lipoprotein particle number and sizes were normal.	PMC7477955	PMC7477955.txt
ALL	ALL		Hematologic profiles showed unremarkable complete blood counts	PMC7477955	PMC7477955.txt
SOME	SOME		One subject had lymphoblasts and was diagnosed with acute lymphocytic leukemia	PMC7477955	PMC7477955.txt
ALL	ALL		Coagulation studies showed normal prothrombin time (PT), partial thromboplastin time (PTT), and international normalized ratio (INR)	PMC7477955	PMC7477955.txt
SOME	SOME		Low protein C activity was observed in 6 subjects	PMC7477955	PMC7477955.txt
SOME	SOME		Low Factor II activity was observed in 1 subject	PMC7477955	PMC7477955.txt
SOME	SOME		Low Factor IX was observed in 2 subjects	PMC7477955	PMC7477955.txt
SOME	SOME		Low Factor XI was observed in 2 subjects	PMC7477955	PMC7477955.txt
SOME	SOME		Low fibrinogen was observed in 5 subjects	PMC7477955	PMC7477955.txt
ALL	ALL		All factors except for Antithrombin III were lower in individuals with the c.1201A>T mutation	PMC7477955	PMC7477955.txt
SOME	SOME		Significant differences in Factor II, Factor IX, and Factor XI were observed in individuals with the c.1201A>T mutation at p<0.05 using the two sample t-test.	PMC7477955	PMC7477955.txt
ALL	ALL		Seven of 11 individuals tested exhibited out of range elevations in antibody titers towards rubella and/or rubeola following MMR vaccination. Biochemical markers known to be abnormal in mitochondropathies and hypoglycosylation disorders showed inconsistent results.	PMC7477955	PMC7477955.txt
ALL	ALL		Bone age was delayed in eight of the 11 subjects tested without any consistent abnormalities of the endocrine system: the somatotropic axis and thyroid function were normal in all studied individuals.	PMC7477955	PMC7477955.txt
ALL	ALL		Femoral bone density was low in all nine individuals who underwent DEXA scanning (mean, SEM z-scores for 8 patients < 21 years adjacent to the growth plate = −3, 0.4; metaphysis-diaphysis = −2.2, 0.6, and diaphysis = −1.8, 0.5).	PMC7477955	PMC7477955.txt
ALL	ALL		All subjects had joint hypermobility except the older ones, who had contractures in both small and large joints.	PMC7477955	PMC7477955.txt
ALL	ALL		Complete skeletal surveys were performed on 11 individuals; abnormalities included coxa valga (n=11), scoliosis (n=6), growth arrest lines or metaphyseal banding without palmidronate treatment (n=4), dislocations or subluxations involving the hips and shoulder joints (n=3), and sclerosis of the phalanges or tarsal bones (n=2).	PMC7477955	PMC7477955.txt
ALL	ALL		Findings noted only once included flexion deformity of the fingers, hallux valgus, sclerotic lesion of the distal femur, thinning of the fibulas, prominent apophyseal bone formation in the ileac crests and ischia, ulnar bowing, expansion of the cortexes in the proximal and middle phalanges in digits 2–4, widened phalanges, and shortened and widened metatarsals.	PMC7477955	PMC7477955.txt
ALL	ALL		Our prospective investigations into NGLY1-CDDG revealed several new discoveries associated with this disorder. These included low CSF total protein and albumin, optic atrophy and retinal pigmentary changes/cone dystrophy, poor weight gain starting in mid- childhood, lower than predicted resting energy expenditure, central and obstructive sleep apnea, delayed bone age, joint hypermobility, progressive brain atrophy, abnormalities in brain MRS-measured metabolites, various abnormalities on skeletal survey, high antibody titers after rubella and rubeola vaccination, and low levels of several pro- and anti- coagulation factors. Echocardiograms, electrocardiograms, and CSF lactate levels were normal.	PMC7477955	PMC7477955.txt
ALL	ALL		Patients showed global developmental delay, movement disorder, frequent seizure disorder, hypotonia, hypolacrima or alacrima, corneal disease, ptosis, lagophthalmous, strabismus, peripheral neuropathy and occasional diminished reflexes, hypohidrosis, auditory brainstem response abnormalities, abnormal brain imaging, scoliosis, acquired microcephaly, small hands and feet, dysmorphic features, constipation, elevated liver enzymes present only early in childhood, osteopenia, and hypocholesterolemia associated with NGLY1-CDDG. Transient elastography results showed minimal if any fibrosis. No abnormal storage material was observed in the three liver biopsy specimens analyzed, nor was ocular apraxia observed, despite performing detailed ophthalmologic evaluations that involved some subjects previously reported to have ocular apraxia.	PMC7477955	PMC7477955.txt
ALL	ALL		Patients considered for NGLY1-CDDG differential diagnosis due to the tetrad of developmental delay/intellectual disability, hyperkinetic movement disorder, hypolacrima, and a history of elevated transaminases during early childhood.	PMC7477955	PMC7477955.txt
ALL	ALL		Patients have auditory neural pathway dysfunction without peripheral hearing loss, resembling auditory neuropathy. They experience difficulty hearing in the presence of background noise and benefit from quiet listening environments. If hypohidrosis is detected, preventative measures (hydration, ventilation, etc.) against situations that cause dangerous core body hyperthermia can be taken. It is important to aggressively manage hypo-lacrima with artificial tears and bland ointment to prevent secondary complications that can impact vision. They have disordered mastication for solids but a functional ability to swallow, suggesting the need for oral motor and swallowing therapies to facilitate better control and chewing maturation.	PMC7477955	PMC7477955.txt
