patient_id	patient_accession	external_study	details	doc_id	doc_filename
ALL	ALL		Patients have low Motor Skills scores and Daily Living Skills scores due to significant motor involvement required for daily tasks. They have a hyperkinetic movement disorder due to NGLY1-CDDG. This disorder may be caused by myoclonic seizures, neurotransmitter deficiency, and/or peripheral neuropathy manifesting as sensory ataxia.	PMC7477955	PMC7477955.txt
ALL	ALL		Results from MRS showed that as functional impairment worsened and age increased, NAA decreased, while choline, myo-inositol and creatine increased. Additionally, creatine and myoinositol were inversely correlated, and NAA directly correlated, with neurotransmitter levels (5-HIAA, 5-HVA, 3-OMD, and neopterin). NAA may be found exclusively in neurons and declines as neurons become unhealthy or die. Elevations in choline could be consistent with a relative abundance of glial cells secondary to neuronal loss. Myo-inositol is a glia-specific marker that is elevated by gliosis or inflammation; in our cohort we do not have any evidence of inflammation. Creatine levels are relatively higher in glial cells compared to neurons. The MRS findings suggest that there is a relative abundance of glial cells compared to neurons in the brain of NGLY1-CDDG individuals, possibly due to loss of neurons, and that the degree of this imbalance contributes significantly to the severity of the phenotype.	PMC7477955	PMC7477955.txt
ALL	ALL		Individuals with NGLY1-CDDG share phenotypic features of low cholesterol, hepatopathy, peripheral neuropathy, retinal and optic nerve abnormalities, seizures, developmental delay with socialization as a relative strength, and delayed bone age. They also exhibit hypolacrima, a feature shared with O-linked glycosylation disorders. N-glycanase 1, which catalyzes the cleavage of the amide bond between the proximal N-acetylglucosamine residue of glycans and the asparagine residue of the protein, may be pathogenically related to NGLY1-CDDG. This could impair glycan recycling and lead to hypoglycosylation. Subtle abnormalities in transferrin and ApoC-III glycosylation were observed in these individuals.	PMC7477955	PMC7477955.txt
ALL	ALL		Preliminary experiments found no impairment or enhancement of standard ERAD marker expression under normal conditions in NGLY1-CDDG patient fibroblasts.	PMC7477955	PMC7477955.txt
ALL	ALL		NGLY1-CDDG is a progressive disorder. The Nijmegen severity scores and Vineland scores indicated worsening function with age. Also progressive were the peripheral neuropathy, auditory neural dysfunction, scoliosis, inability to maintain weight, brain atrophy on MRI, abnormalities in brain metabolites measured on MRS, and CSF neurotransmitter levels. Hypolacrima occurred at all ages, and the hepatopathy and hyperkinetic movement disorder appeared to improve with age.	PMC7477955	PMC7477955.txt
ALL	ALL		This study reports on several mutations of the NGLY1 gene. The mutations include NM_018297.3:c.931G>A, NM_018297.3:c.1604G>A, NM_018297.3:c.622C>T, NM_018297.3:c.347C>G, NM_018297.3:c.1169G>C, NM_018297.3:c.730T>C, NM_018297.3:c.1910delT, NM_018297.3:c.930C>T, NM_018297.3:c.881+5G>T. Four of these mutations lie within the catalytic domain (amino acid residues 292–353);, i.e., c.730T>C, c.953T>C, c.931G>A, and c.930C> T. The study does not provide specific information about individual patients, their phenotypes, physical or behavioral traits, demographics, lab measurements, treatments, or family histories.	PMC7477955	PMC7477955.txt
ALL	ALL		Individuals with NGLY1-CDDG have facial features including upturned nasal tip, hypotonic facies, ptosis, brachycephaly, thinned facies, hollowed cheeks, and visible zygomatic arches. Interpupillary distance ranged from the 13–95 centiles with the mean at the 66th centile, and SEM of 8. Horizontal fissure length ranged from 3–70 centiles with mean at the 20th centile, and SEM of 1. Inner canthal distance ranged from 3–100 centiles with the mean at the 59th centile and SEM of 10. Outer canthal distance ranged from 6–81 centile with mean at the 43 centile and SEM of 7. Canthal index ranged from −2 to +2 SD from the normal mean.	PMC7477955	PMC7477955.txt
SOME	SOME		Two of eleven individuals showed white matter lesions in their brain MRI findings. One had multiple lesions in the periventricular white matter, some of which were confluent. The other had a single lesion in the periventricular white matter. Both showed cerebral atrophy and slightly prominent sulci. One of them had prominent ventricles.	PMC7477955	PMC7477955.txt
ALL	ALL		Right eye close-up showing conjunctival injection, limbal neovascularization, and corneal scarring in an NGLY1 patient. Findings caused by severe dry eyes and lagophthalmous.	PMC7477955	PMC7477955.txt
