patient_id	patient_accession	external_study	details	doc_id	doc_filename
ALL	ALL		All patients had global developmental delay, a movement disorder, and hypotonia.	PMC4243708	PMC4243708.txt
SOME	SOME		7 out of 8 patients had hypo- or alacrima.	PMC4243708	PMC4243708.txt
SOME	SOME		6 out of 7 patients had elevated liver transaminases.	PMC4243708	PMC4243708.txt
SOME	SOME		6 out of 8 patients had microcephaly.	PMC4243708	PMC4243708.txt
SOME	SOME		6 out of 8 patients had diminished reflexes.	PMC4243708	PMC4243708.txt
SOME	SOME		5 out of 6 patients had hepatocyte cytoplasmic storage material or vacuolization.	PMC4243708	PMC4243708.txt
SOME	SOME		4 out of 8 patients had seizures.	PMC4243708	PMC4243708.txt
ALL	ALL		The most common deleterious allele was the nonsense mutation c.1201A>T (p.R401X).	PMC4243708	PMC4243708.txt
Original Patient	Original Patient	Need et al.	3-year-old boy with compound heterozygous inactivating mutations in NGLY1. Clinical phenotype suggestive of a congenital disorder of glycosylation, although repeated transferrin isoelectric focusing and N-glycan analyses were normal. Liver biopsy showed accumulation of an amorphous unidentified substance throughout the cytoplasm, a finding likely consistent with NGLY1 dysfunction, which would be expected to result in abnormal accumulation of misfolded glycoproteins because of impaired cytosolic degradation.	PMC4243708	PMC4243708.txt
ALL	ALL		Seven newly diagnosed patients with mutations in NGLY1. These observations confirm NGLY1 deficiency as an inherited disorder associated with the ERAD process and document its clinical presentation.	PMC4243708	PMC4243708.txt
1	1		Exome sequencing was performed at Duke University using the Illumina HiSeq2000 platform and the Agilent SureSelect Human All Exon 50 Mb Kit.	PMC4243708	PMC4243708.txt
2	2		WES was performed on a clinical basis at Baylor College of Medicine Whole Genome Laboratory, Houston, Texas.	PMC4243708	PMC4243708.txt
3	3		Sequenced at Stanford University using both Illumina HiSeq2000 and Complete Genomics platforms. Variants in Illumina-sequenced reads were called using both the Hugeseq and Real Time Genomics pipelines and Complete Genomics variants were identified by their own variant callers. DNA was also capture-sequenced at Baylor College of Medicine using a commercially developed capture reagent (VCRome2). Sequence data were generated on an Illumina HiSeq2000 producing an average coverage of 80× with >90% of targeted bases at 20× coverage or higher.	PMC4243708	PMC4243708.txt
4	4		Sanger sequencing of NGLY1 was performed at Duke University and results were confirmed by a clinical laboratory (GeneDx, Gaithersburg, Maryland).	PMC4243708	PMC4243708.txt
5	5		Exome sequencing was performed at University of British Columbia using the Illumina HiSeq2000 platform and the Agilent SureSelect Human All Exon 50 Mb Kit.	PMC4243708	PMC4243708.txt
6	6		Exome sequencing was performed at University of British Columbia using the Illumina HiSeq2000 platform and the Agilent SureSelect Human All Exon 50 Mb Kit. WES was also performed on a clinical basis at Emory Genetics Laboratory, Atlanta, Georgia.	PMC4243708	PMC4243708.txt
7	7		WES was performed on a clinical basis at Emory Genetics Laboratory, Atlanta, Georgia.	PMC4243708	PMC4243708.txt
ALL	ALL		All patients had global developmental delay, a movement disorder, and hypotonia. Other common findings included hypo- or alacrima (7/8), abnormal brain imaging (7/8), EEG abnormalities (7/8), elevated liver transaminases (6/7), microcephaly (6/8), diminished reflexes (6/8), hepatocyte cytoplasmic storage material or vacuolization (5/6), seizures (4/8), and abnormal nerve conduction (3/3). Two of the patients died prematurely at 9 months and 5 years of age.	PMC4243708	PMC4243708.txt
1	1		5 year old, male, Caucasian, no consanguinity, mutations: c.C1891del (p.Q631S)/c.1201A>T(p.R401X), no IUGR, brain imaging abnormalities, global developmental delay, hypotonia, movement disorder, EEG abnormalities, decreased DTRs, seizures, alacrima/hypolacrima, corneal ulcerations/scarring, chalazions, elevated liver transaminases, elevated AFP, liver fibrosis, liver storage or vacuolization, constipation, small hands/feet, peripheral neuropathy	PMC4243708	PMC4243708.txt
2	2		20 year old, female, Caucasian, consanguinity, mutations: c.1370dupG(p.R458fs)/c.1370dupG(p.R458fs), IUGR, no brain imaging abnormalities, global developmental delay, microcephaly, hypotonia, movement disorder, EEG abnormalities, decreased DTRs, ocular apraxia, alacrima/hypolacrima, corneal ulcerations/scarring, elevated liver transaminases, liver storage or vacuolization, constipation, scoliosis, peripheral neuropathy	PMC4243708	PMC4243708.txt
3	3		4 year old, female, Caucasian, no consanguinity, mutations: c.1205_1207del(p.402_403del)/c.1570C>(p. R524X), no IUGR, brain imaging abnormalities, global developmental delay, microcephaly, hypotonia, movement disorder, EEG abnormalities, ocular apraxia, alacrima/hypolacrima, chalazions, strabismus, ABR abnormalities, lactic acidosis, neonatal jaundice, elevated liver transaminases, liver storage or vacuolization, constipation, small hands/feet	PMC4243708	PMC4243708.txt
4	4		2 year old, male, Caucasian, no consanguinity, mutations: c.1201A>T(p. R401X)c.1201A>T(pR401X), IUGR, brain imaging abnormalities, global developmental delay, hypotonia, movement disorder, EEG abnormalities, decreased DTRs, seizures, alacrima/hypolacrima, corneal ulcerations/scarring, chalazions, strabismus, ABR abnormalities, lactic acidosis, neonatal jaundice, elevated liver transaminases, elevated AFP, liver fibrosis, constipation, dysmorphic features, scoliosis, small hands/feet	PMC4243708	PMC4243708.txt
5	5		0.5 year old, male, Caucasian, no consanguinity, mutations: c.1201A>T(p. R401X)/c.1201A>T(p.R401X), IUGR, brain imaging abnormalities, global developmental delay, microcephaly, hypotonia, movement disorder, EEG abnormalities, decreased DTRs, seizures, alacrima/hypolacrima, elevated liver transaminases, elevated AFP, liver storage or vacuolization, constipation, dysmorphic features, scoliosis	PMC4243708	PMC4243708.txt
6	6		9 month old, female, Caucasian, no consanguinity, mutations: c.1201A>T(p. R401X)/c.1201A>T(p.R401X), IUGR, brain imaging abnormalities, global developmental delay, microcephaly, hypotonia, movement disorder, EEG abnormalities, decreased DTRs, alacrima/hypolacrima, elevated liver transaminases, liver storage or vacuolization, constipation	PMC4243708	PMC4243708.txt
7	7		3 year old, female, Caucasian, no consanguinity, mutations: c.1201A>Y(p. R401X)/c.1201A>T(p.R401X), no IUGR, no brain imaging abnormalities, global developmental delay, microcephaly, hypotonia, movement disorder, EEG abnormalities, decreased DTRs, ocular apraxia, alacrima/hypolacrima, chalazions, strabismus, lactic acidosis, neonatal jaundice, elevated liver transaminases, constipation, dysmorphic features	PMC4243708	PMC4243708.txt
8	8		16 year old, female, Caucasian, no consanguinity, mutations: c1201A>T(p. R401X)/c.1201A>T(p.R401X), IUGR, brain imaging abnormalities, global developmental delay, microcephaly, hypotonia, movement disorder, EEG abnormalities, decreased DTRs, seizures, ocular apraxia, alacrima/hypolacrima, corneal ulcerations/scarring, strabismus, lactic acidosis, elevated liver transaminases, constipation, dysmorphic features, scoliosis, small hands/feet	PMC4243708	PMC4243708.txt
1	1		5-year-old male, presented in the neonatal period with involuntary movements, including athetosis involving the trunk and extremities and constant lip smacking and pursing while awake. Pregnancy and birth history were unremarkable. He had mild neonatal jaundice requiring phototherapy, but otherwise appeared well. Global developmental delay, hypotonia, intractable multifocal epilepsy, consisting of myoclonic seizures, drop attacks, and staring or tonic episodes, and liver disease were present in infancy. He has cortical vision loss and congenital alacrima and corneal ulcerations with scarring were noted at age 4 years. Now, at age 5 years, the movement disorder has not abated and he has central hypotonia and global developmental delay.	PMC4243708	PMC4243708.txt
2	2		20-year-old female, born at 39 weeks of gestation via Cesarean section due to intrauterine growth retardation and an abnormal appearing placenta. Noted hypotonia, developmental delay and elevated liver transaminases at four months of age. At approximately 4 years of age, observed to have a slight intention tremor and frequent involuntary movements of her neck, hands and arm. At 5 years of age, she was noted to have ocular apraxia, distal tapering of hands and feet, and diminished deep tendon reflexes. She has cortical vision impairment, alacrima and dry eyes that require lubrication, but has not developed corneal scarring. Presently, she has marked intellectual disabilities and requires total care. She has very little expressive speech and communicates through an electronic speech-generating device. She continues to ambulate with a walker.	PMC4243708	PMC4243708.txt
3	3		4-year-old girl, born via Cesarean section at term for a non-reassuring fetal heart tracing, monitored in the NICU due to poor feeding and lethargy. Pregnancy was complicated by a positive second trimester screen noting increased risk for Smith-Lemli Opitz syndrome (SLOS) and trisomy 18, but karyotype on amniocentesis was normal. As a neonate, she had hyperbilirubinemia treated with phototherapy, elevated liver transaminases and transient thrombocytopenia. In infancy, she had global developmental delay, acquired microcephaly, bilateral exotropia, hypotonia, constipation, and intermittent mild lactic acidemia. At age 1 year, she did not make tears when crying, but had adequate tear production to keep her eyes moist. She had intermittent chalazions, but no corneal scarring. She developed staring spells, lasting up to 15 seconds, at approximately age 1 year; these episodes occur about once daily and can be interrupted by gentle contact. By age 17 months she had developed an extrapyramidal movement disorder consisting of asynchronous myoclonic jerks of the limbs and shoulders and subtle choreoathetotic movements of the hands and fingers. At 4 years she can ambulate unassisted, although her gait is unsteady, and communicates with vocalizations, gestures and use of a speech-generating device.	PMC4243708	PMC4243708.txt
4	4		2-year-old boy, delivered by Cesarean section at 38 weeks of gestation after fetal distress was noted on cardiotocography. Pregnancy history was positive for intrauterine growth restriction (IUGR) and oligohydramnios. He had mild hyperbilirubinemia, but otherwise his neonatal course was unremarkable and he was discharged on day of life three. Intermittent head flexion was noted at 6 months, and an EEG at 8 months showed generalized poly-spike discharges. Soon thereafter, mild tonic seizures with head and body flexion started, and evolved to single, symmetric spasms with bilateral arm extension. Involuntary movements of the upper extremities were also noted at this time. In addition, global developmental delay, bilateral ptosis, abnormal tear production, elevated liver transaminases (3 to 4 times upper limit of normal), and constipation were noted in infancy. He has had recurrent episodes of keratoconjunctivitis and poor lid closure during sleep with resultant corneal scarring.	PMC4243708	PMC4243708.txt
5	5		Patient 5, a boy, died at the age of 5 years. He was born at term following a pregnancy that was complicated by a positive second trimester serum screening for trisomy 18 and Smith- Lemli-Opitz syndrome (SLOS) (AFP 1.97 MoM, uE3 0.24 MoM and hCG 0.48 MoM). Cytogenetic analysis of cultured amniocytes showed a normal male karyotype and measurement of 7-dehydrocholesterol in amniotic fluid excluded SLOS. He was delivered by Cesarean section at 36 weeks of gestation due to concerns for IUGR and a non-reassuring stress test. He had mild flexion contractures of both knees, but had an uneventful neonatal period. He had global developmental delay and constant movements of his arms and legs since early infancy and developed head bobbing at 7 months. At 8 months, liver transaminase elevations (approximately 1.5 times the upper limit of normal) were noted, and the elevations persisted until age 3 1⁄2 years. His reflexes appeared normal in infancy, but were diminished by age 2 years and at 38 months could no longer be elicited. During the second year of life, he was noted to have dry eyes that were treated with lubricant drops at bedtime, and microcephaly was present by 16 months. At 2 1⁄2 years, he developed myoclonic seizures that became intractable despite numerous therapeutic trials. Between the ages of 10 months and five years, he showed slow developmental progress, but regressed during the last year. He died at age 5 years following a viral illness and a prolonged seizure.	PMC4243708	PMC4243708.txt
6	6		Patient 6 is the younger sister of Subject 5. The pregnancy was complicated by a positive second trimester serum screen for trisomy 18 and SLOS (AFP 0.87 MoM, uE3 0.31 MoM, hCG 0.57 MoM). Cytogenetic analysis of cultured amniocytes showed a normal female karyotype. She was delivered by Cesarean section at 35 weeks of gestation following an ultrasound that was concerning for IUGR. She had jaundice requiring phototherapy, but her course in the nursery was otherwise uneventful. By age 9 months, developmental delay was apparent and she had developed hypotonia, microcephaly, a mildly myopathic- appearing face and constant involuntary movements with a tendency to hyperextend her arms and close her fists. At 9 1⁄2 months of age, she died unexpectedly in her sleep and the cause of death remains unknown.	PMC4243708	PMC4243708.txt
7	7		3-year-old girl, born at term via scheduled Cesarean section, had mild jaundice at birth, prenatal screen showed an increased risk for trisomy 21, noted to have strabismus, hypotonia, athetoid arm and hand movements, clasped hands, and elevated liver transaminases (approximately 3 times upper limit of normal) in infancy, microcephaly was present by age 2 years, severe developmental delay was present but she has shown slow progress without regression, learned to sit alone and started to crawl at 2 years, but had no words.	PMC4243708	PMC4243708.txt
8	8		16-year-old girl, older sister of Subject 7, born at term via Cesarean section for decreased fetal movement and bradycardia. Prenatal history was significant for IUGR. Had cyanosis at birth and required resuscitation. Anal stenosis requiring dilatation was noted in the first week of life. Noted to have hypotonia, a movement disorder consisting of head bobbing and extremity athetosis, and developmental delay in early infancy. At 3 years, she could stand unsupported, ambulate with a walker, and started to babble. Seizures developed at age 11 years and she lost all mobility. Other medical history includes acquired microcephaly, an inability to close her eyes completely during sleep, chronic conjunctivitis, corneal clouding, hypolacrima, strabismus, hearing impairment, gastro-esophageal reflux, chronic constipation, severe scoliosis and talipes equinovarus.	PMC4243708	PMC4243708.txt
1	1		Whole exome sequencing (WES) performed as part of a research protocol detected putative knock out mutations forming a compound heterozygote genotype in the NGLY1 gene (Maternal frameshift: Q631S. at cDNA level: C1891del in transcript ENST00000280700. EXON 12. Paternal nonsense: 3_25750426_A, which causes a nonsense mutation, R401X, in transcript ENST00000280700. At the cDNA level this is A1201T EXON 8)	PMC4243708	PMC4243708.txt
ALL	ALL		The nonsense mutation c.1201A>T (p.R401X) was the most common deleterious allele identified, present in homozygous state in 5 of 8 cases and in compound heterozygous state in one case.	PMC4243708	PMC4243708.txt
2	2		Did not carry the c.1201A>T (p.R401X) mutation and their clinical phenotype was relatively mild in comparison	PMC4243708	PMC4243708.txt
3	3		Did not carry the c.1201A>T (p.R401X) mutation and their clinical phenotype was relatively mild in comparison	PMC4243708	PMC4243708.txt
Patient 2	2		WES (Baylor College of Medicine Whole Genome Laboratory) revealed a homozygous mutation in exon 9 of the NGLY1 gene denoted as c.1370dupG or p.R458fs. Both parents were confirmed to be heterozygous carriers by Sanger sequencing. The mutation causes a frame shift in codon 458, causing insertion of 13 incorrect residues before a stop codon is introduced towards the end of exon 9. The mutation was not seen in any of 3321 other subjects sequenced at Duke, nor was it seen in 6503 subjects on the Exome Variant Server (NHLBI GO Exome Sequencing Project (ESP), Seattle, WA.	PMC4243708	PMC4243708.txt
3	3		WES and whole-genome sequencing were performed using research protocols at Baylor College of Medicine and Stanford University. Mutations in NGLY1 that followed a compound heterozygous inheritance pattern were identified. A stop gain mutation caused by a G>A mutation at position 3:25761670 (hg19) resulting in p.R542X was identified in both the father and daughter. A 3 base pair in-frame deletion TCC> beginning at position 3:25775416 (hg19) was identified in both the mother and daughter. An additional G>T mutation resulting in a heterozygous SMP at position 3:25777564 was identified in the daughter, mother and father. This mutation was not previously observed in 1000 genomes and is a coding region; however, it is present in heterozygous form in all three individuals.	PMC4243708	PMC4243708.txt
Patient 4	4		Sanger sequencing (Duke University) detected a homozygous nonsense mutation, p.R401X, at position 3:25775422 (hg19) in transcript ENST00000280700. At the cDNA level this is c.1201A>T in exon 8 of NGLY1. This finding was confirmed in a CLIA- certified laboratory (GeneDx).	PMC4243708	PMC4243708.txt
5	5		The variant in NGLY1, single nucleotide variant T> A at position 3:25775422 (hg19), which was called to be homozygous, was present in the mother’s exome as a heterozygous call. This base pair substitution causes a nonsense mutation, R401X. The NGLY1 variant was independently validated by Sanger sequencing in the patient and both parents.	PMC4243708	PMC4243708.txt
6	6		The variant in NGLY1, single nucleotide variant T> A at position 3:25775422 (hg19), which was called to be homozygous, was present in the mother’s exome as a heterozygous call. This base pair substitution causes a nonsense mutation, R401X. The NGLY1 variant was independently validated by Sanger sequencing in the patient and both parents.	PMC4243708	PMC4243708.txt
7	7		WES detected a homozygous nonsense mutation, R401X, at position 3:25775422 (hg19) in transcript ENST00000280700. At the cDNA level this is c.1201A>T in exon 8 of NGLY1.	PMC4243708	PMC4243708.txt
8	8		WES detected a homozygous nonsense mutation, R401X, at position 3:25775422 (hg19) in transcript ENST00000280700. At the cDNA level this is c.1201A>T in exon 8 of NGLY1.	PMC4243708	PMC4243708.txt
ALL	ALL		Patients have compound heterozygous knockout mutations in NGLY1. They have a clinical triad consisting of abnormal tear production, choreoathetosis and liver disease. Other common findings include global developmental delay, acquired microcephaly, hypotonia, EEG abnormalities with or without overt seizures, brain imaging abnormalities, a peripheral neuropathy, constipation and a history of IUGR. Some patients were noted to have dysmorphic features. Low uE3 was present in three patients, including in two children who died and were found to have significant adrenal cortex vacuolation. Adrenal function was not specifically evaluated in our patients, some degree of dysfunction remains possible.	PMC4243708	PMC4243708.txt
ALL	ALL		Patients commonly had abnormalities detected on brain imaging, but findings were typically mild and non-specific. The combination of hypo- or alacrima and a movement disorder consisting of tremulousness and varying degrees of choreoathetosis appear to be pathognomonic for NGLY1 deficiency. Unlike CDGs, NGLY1 deficiency does not appear to be associated with cerebellar atrophy, lipodystrophy, or significant heart manifestations. Lactic acidemia was variably present, but tended to be mild; chronic elevations were not noted in any patient.	PMC4243708	PMC4243708.txt
3	3		A moderate reduction in mitochondrial DNA content was identified in a liver sample	PMC4243708	PMC4243708.txt
5	5		Significant brain disease was noted on autopsy, found to have pathological changes consistent with hypoxic-ischemic encephalopathy (HIE)	PMC4243708	PMC4243708.txt
6	6		Significant brain disease was noted on autopsy, found to have pathological changes consistent with hypoxic-ischemic encephalopathy (HIE)	PMC4243708	PMC4243708.txt
ALL	ALL		No specific patient information is provided. However, it is mentioned that patients with mutations in MAN1B1, the gene coding for α-1,2-mannosidase, are associated with non-syndromic autosomal recessive intellectual disability and subtle dysmorphic features. α-1,2-Mannosidase is a type II transmembrane protein that is primarily localized to the Golgi apparatus, where it undergoes O-glycosylation and participates in glycoprotein quality control.	PMC4243708	PMC4243708.txt
ALL	ALL	24,25	Patients with autosomal recessive mutations in ERLIN2 present profound intellectual disability, developmental regression and multiple contractures. Abnormal erlin2 causes impaired ERAD of activated inositol 1,4,5-triphosphate receptors (IP3) and other substrates by compromising the structure of the erlin1/2 complex. Despite the severity of the intellectual disability and neuromuscular findings, the results of brain imaging, electromyography and muscle biopsy appeared normal in these patients.	PMC4243708	PMC4243708.txt
ALL	ALL	26	A family was found to have a homozygous null mutation in ERLIN2, with affected individuals presenting with a hereditary spastic paraplegia phenotype.	PMC4243708	PMC4243708.txt
ALL	ALL		NGLY1 deficiency results in accumulation of intact glycoproteins in the cytoplasm. Three patients showed accumulation of an amorphous substance in the liver, and two others showed vacuolization consistent with storage, which may explain the liver disease noted in these patients. The undefined stored substance likely represents accumulation of misfolded glycoproteins in the cytoplasm that have been retrotranslocated from the ER but cannot undergo further processing. Transferrin isoelectric focusing or mass spectrometry studies in NGLY1-deficient patients have been normal or only subtly abnormal.	PMC4243708	PMC4243708.txt
ALL	ALL		Patients have axonal loss and gliosis in the brains suggestive of HIE, indicating that NGLY1 plays a role in maintaining central nervous system integrity. They also seem to have peripheral neuropathy that is relatively common in NGLY1 deficiency. Further studies are needed to determine the underlying pathogenesis of both central and peripheral nervous system abnormalities.	PMC4243708	PMC4243708.txt
1	1		Patient 1 has a compound heterozygous state of the c.1201A>T (p.R401X) mutation.	PMC4243708	PMC4243708.txt
4	4		Patient 4 has a homozygous state of the c.1201A>T (p.R401X) mutation. This mutation is associated with a severe phenotype, with outcomes ranging from early demise to living into teenage years.	PMC4243708	PMC4243708.txt
5	5		Patient 5 has a homozygous state of the c.1201A>T (p.R401X) mutation. This mutation is associated with a severe phenotype, with outcomes ranging from early demise to living into teenage years.	PMC4243708	PMC4243708.txt
6	6		Patient 6 has a homozygous state of the c.1201A>T (p.R401X) mutation. This mutation is associated with a severe phenotype, with outcomes ranging from early demise to living into teenage years.	PMC4243708	PMC4243708.txt
7	7		Patient 7 has a homozygous state of the c.1201A>T (p.R401X) mutation. This mutation is associated with a severe phenotype, with outcomes ranging from early demise to living into teenage years.	PMC4243708	PMC4243708.txt
8	8		Patient 8 has a homozygous state of the c.1201A>T (p.R401X) mutation. This mutation is associated with a severe phenotype, with outcomes ranging from early demise to living into teenage years.	PMC4243708	PMC4243708.txt
2	2		Patient 2 does not carry the c.1201A>T (p.R401X) mutation and appears to have a relatively mild phenotype.	PMC4243708	PMC4243708.txt
3	3		Patient 3 does not carry the c.1201A>T (p.R401X) mutation and appears to have a relatively mild phenotype.	PMC4243708	PMC4243708.txt
ALL	ALL		NGLY1 deficiency is characterized by unique features including elevation of AFP and liver enzymes in infancy with relative normalization in early childhood, accumulation of a substance with staining properties similar to glycogen in hepatocyte cytoplasm, absent tears resulting in blepharitis and corneal ulceration, a movement disorder and peripheral neuropathy. The transient nature of the AFP and liver transaminase elevation may make older or more mildly affected individuals difficult to detect.	PMC4243708	PMC4243708.txt
ALL	ALL		12 individuals ages 2 to 21 years with confirmed, biallelic, pathogenic NGLY1 mutations. Clinical features include optic atrophy and retinal pigmentary changes/cone dystrophy, delayed bone age, joint hypermobility, and lower than predicted resting energy expenditure. Laboratory findings include low CSF total protein and albumin, and unusually high antibody titers towards rubella and/or rubeola following vaccination. Confirmed and further quantified previously reported findings noting that decreased tear production, transient transaminitis, small feet, a complex hyperkinetic movement disorder, and varying degrees of global developmental delay with relatively preserved socialization are the most consistent features.	PMC7477955	PMC7477955.txt
